{"componentChunkName":"component---src-layouts-projects-layout-tsx","path":"/projects/this_site","result":{"pageContext":{"pagePath":"/projects/this_site","frontmatter":{"title":"This site, actually","date":"04/30/2022","tags":["test","first"],"thumbnail":"this.png","gallery":"this","techs":["typescript","github","gatsby","react","tailwindcss","mdx","figma"],"abstract":"My personal site, which functions as an interactive portfolio and a place where I can blog about my technological victories and mishaps.","link":"https://github.com/KamilRybacki/kamilrybacki.github.io","readme":"https://raw.githubusercontent.com/KamilRybacki/kamilrybacki.github.io/main/README.md"},"content":"var _excluded = [\"components\"];\n\nfunction _extends() { _extends = Object.assign || function (target) { for (var i = 1; i < arguments.length; i++) { var source = arguments[i]; for (var key in source) { if (Object.prototype.hasOwnProperty.call(source, key)) { target[key] = source[key]; } } } return target; }; return _extends.apply(this, arguments); }\n\nfunction _objectWithoutProperties(source, excluded) { if (source == null) return {}; var target = _objectWithoutPropertiesLoose(source, excluded); var key, i; if (Object.getOwnPropertySymbols) { var sourceSymbolKeys = Object.getOwnPropertySymbols(source); for (i = 0; i < sourceSymbolKeys.length; i++) { key = sourceSymbolKeys[i]; if (excluded.indexOf(key) >= 0) continue; if (!Object.prototype.propertyIsEnumerable.call(source, key)) continue; target[key] = source[key]; } } return target; }\n\nfunction _objectWithoutPropertiesLoose(source, excluded) { if (source == null) return {}; var target = {}; var sourceKeys = Object.keys(source); var key, i; for (i = 0; i < sourceKeys.length; i++) { key = sourceKeys[i]; if (excluded.indexOf(key) >= 0) continue; target[key] = source[key]; } return target; }\n\n/* @jsxRuntime classic */\n\n/* @jsx mdx */\nvar _frontmatter = {\n  \"title\": \"This site, actually\",\n  \"date\": \"2022-04-30T00:00:00.000Z\",\n  \"tags\": \"test first\",\n  \"thumbnail\": \"this.png\",\n  \"gallery\": \"this\",\n  \"techs\": \"typescript github gatsby react tailwindcss mdx figma\",\n  \"abstract\": \"My personal site, which functions as an interactive portfolio and a place where I can blog about my technological victories and mishaps.\",\n  \"link\": \"https://github.com/KamilRybacki/kamilrybacki.github.io\",\n  \"readme\": \"https://raw.githubusercontent.com/KamilRybacki/kamilrybacki.github.io/main/README.md\"\n};\nvar layoutProps = {\n  _frontmatter: _frontmatter\n};\nvar MDXLayout = \"wrapper\";\nreturn function MDXContent(_ref) {\n  var components = _ref.components,\n      props = _objectWithoutProperties(_ref, _excluded);\n\n  return mdx(MDXLayout, _extends({}, layoutProps, props, {\n    components: components,\n    mdxType: \"MDXLayout\"\n  }), mdx(\"p\", null, \"At the beginning of 2022, I've made a decision to host my personal website\\nusing GitHub Pages service and Gatsby, while also incorporating TypeScript\\ninstead of vanilla JavaScript to get my feet wet into static typing used in webdev.\"), mdx(\"h2\", null, \"Basic aspects\"), mdx(\"ol\", null, mdx(\"li\", {\n    parentName: \"ol\"\n  }, \"Why this instead of single-page portfolio?\")), mdx(\"p\", null, \"I've decided to introduce the blogging aspect into my site as\\na more \\\"dramatic\\\" section of my portfolio. I know this may be a far fetch,\\nbut I think that posts that may show my gradual improvement in new IT topics\\nand how I approach these new technologies can also give some indication of\\nmy working style/habits and persistence after each succesive failure.\\nSo in short - they can show that a stubborn mind can force\\nthrough any difficulties if the ultimate goal is to learn cool\\nand interesting things.\"), mdx(\"p\", null, \"Furthermore, I \", mdx(\"strong\", {\n    parentName: \"p\"\n  }, \"cannot\"), \" count how many times somebody else\\nsaved me during my professional and amateur work by\\nsimply posting a solution to a very specific problem on their personal site.\\nI am a \", mdx(\"strong\", {\n    parentName: \"p\"\n  }, \"fierce\"), \" believer into the idea that a real engineer\\nshould \", mdx(\"strong\", {\n    parentName: \"p\"\n  }, \"know his fair share\"), \" of stuff, but (sometimes even more) importantly -\\nshould \", mdx(\"strong\", {\n    parentName: \"p\"\n  }, \"know how and where to look\"), \" for information.\\nSo availability of such information is \", mdx(\"strong\", {\n    parentName: \"p\"\n  }, \"crucial\"), \" to me,\\nwhich means that by blogging I can contribute some nuggets\\nof knowledge that an engineer may need during desperate times.\"), mdx(\"ol\", null, mdx(\"li\", {\n    parentName: \"ol\"\n  }, \"Why Gatsby instead of GitHub Pages default i.e. Jekyll?\")), mdx(\"p\", null, \"I was never properly introduced to Ruby, honestly.\\n\", mdx(\"strong\", {\n    parentName: \"p\"\n  }, \"I have nothing against the language\"), \". I may even try it to build\\nsomething with it in the future, but originally I've started\\nmy front-end journey with React, so I am kind of immersed into the\\nJavaScript side of webdev things. That's why I've chosen React\\nas my FE framework and the go-to SSG that uses it under the hood\\nis Gatsby. In short, I am not anti-Jekyll - I've just wanted\\na different stack to polish my React skills.\"), mdx(\"p\", null, \"However, I think \", mdx(\"strong\", {\n    parentName: \"p\"\n  }, \"Jekyll looks cool in applications like virtual gardens\"), \",\\nwhich can be used as a quickly setup knowledge base for small developer teams\\nor to glue together a nice looking Wiki thingymajig.\"), mdx(\"p\", null, \"Also, let's be honest. You can even manually write some cool,\\nmarquee-filled HTML pages, plop them down into \", mdx(\"inlineCode\", {\n    parentName: \"p\"\n  }, \"gh-pages\"), \" branch,\\nbotch some deploy script and call it a day.\\nThe SSG used doesn't really matter - at least in the sense\\nof solely providing the content.\"), mdx(\"ol\", null, mdx(\"li\", {\n    parentName: \"ol\"\n  }, \"Technical details\")), mdx(\"p\", null, \"Since these aspects are covered in the official readme\\nof GitHub project where this site's code is kept,\\nplease refer to that by using the button shown below\\n(btw you can also read what it does in the readme,\\nit's really cool, \", mdx(\"strong\", {\n    parentName: \"p\"\n  }, \"trust me\"), \").\"));\n}\n;\nMDXContent.isMDXComponent = true;"}},"staticQueryHashes":["1682188855","2098254665","3313936189","3545564474"]}